[
  {
    "id": "s-1349-plague",
    "date": "1349-06-01",
    "type": "situation",
    "title": "The Great Pestilence reaches Mālaqa",
    "people": [],
    "places": [
      "malaqa"
    ],
    "wars": [],
    "data": {},
    "source": "sample",
    "sample": true
  },
  {
    "id": "s-1350-madrasa",
    "date": "1349-03-15",
    "type": "reform",
    "title": "The Yūsufiyya madrasa is founded",
    "people": [
      "yusuf-i"
    ],
    "places": [
      "gharnata"
    ],
    "wars": [],
    "data": {
      "estate": "clergy"
    },
    "source": "sample",
    "sample": true
  },
  {
    "id": "s-1354-death",
    "date": "1354-10-19",
    "type": "ruler_change",
    "title": "Yūsuf I is murdered at prayer; Muḥammad V succeeds",
    "people": [
      "yusuf-i",
      "muhammad-v"
    ],
    "places": [
      "gharnata"
    ],
    "wars": [],
    "data": {},
    "source": "sample",
    "sample": true
  },
  {
    "id": "s-1354-regency",
    "date": "1354-10-20",
    "type": "estate_change",
    "title": "Riḍwān takes the regency; the ʿumarāʾ rise",
    "people": [
      "ridwan"
    ],
    "places": [],
    "wars": [],
    "data": {
      "estate": "nobles",
      "power": 10
    },
    "source": "sample",
    "sample": true
  }
]