[
  {
    "id": "s-1361-war",
    "date": "1361-09-01",
    "type": "war_declared",
    "title": "War on the Marinids for Runda",
    "people": [],
    "places": [
      "rundah"
    ],
    "wars": [
      "sample-war-runda"
    ],
    "data": {},
    "source": "sample",
    "sample": true
  },
  {
    "id": "s-1361-battle",
    "date": "1361-11-14",
    "type": "battle",
    "title": "Battle at the Wādī Lakku",
    "people": [],
    "places": [
      "rundah"
    ],
    "wars": [
      "sample-war-runda"
    ],
    "data": {
      "result": "victory",
      "ours": 9000,
      "theirs": 7000,
      "ourLosses": 900,
      "theirLosses": 2600,
      "warScore": 9
    },
    "source": "sample",
    "sample": true
  },
  {
    "id": "s-1362-siege",
    "date": "1362-03-22",
    "type": "siege",
    "title": "Fall of Runda",
    "people": [],
    "places": [
      "rundah"
    ],
    "wars": [
      "sample-war-runda"
    ],
    "data": {
      "result": "taken",
      "warScore": 13
    },
    "source": "sample",
    "sample": true
  },
  {
    "id": "s-1362-peace",
    "date": "1362-05-01",
    "type": "peace",
    "title": "Runda ceded by the Marinids",
    "people": [],
    "places": [
      "rundah"
    ],
    "wars": [
      "sample-war-runda"
    ],
    "data": {},
    "source": "sample",
    "sample": true
  },
  {
    "id": "s-1365-crown",
    "date": "1365-02-01",
    "type": "reform",
    "title": "The sultan buys back the frontier commands",
    "people": [
      "muhammad-v"
    ],
    "places": [],
    "wars": [],
    "data": {
      "estate": "crown"
    },
    "source": "sample",
    "sample": true
  }
]