[
 {
  "id": "1360-06-26-marinid-war",
  "date": "1360-06-26",
  "type": "war_declared",
  "people": [
   "yusuf-i"
  ],
  "wars": [
   "marinid-submission-war"
  ],
  "title": "The Marīnids declare war on Gharnāṭa itself, demanding its submission as their subject, with Tilimsān, Tāfīlālt and Tuwāt beside them. Qashtāla takes the field to defend its tributary, and Portugal with it. It comes a year before the court meant to seek the Marīnids' alliance for a war of independence, and with relations between the two courts at their warmest",
  "data": {
   "casusBelli": "cb_demand_andalusi_submission",
   "attackers": [
    "MOR",
    "TLE",
    "TFL",
    "TAT"
   ],
   "defenders": [
    "GRA",
    "CAS",
    "POR"
   ],
   "relationsWithMorocco": 150,
   "manpower": {
    "GRA": [
     2311,
     6506
    ],
    "CAS": [
     87,
     3289
    ],
    "POR": [
     4276,
     4259
    ],
    "MOR": [
     2171,
     2490
    ]
   }
  },
  "source": "save of 26 June 1360; Trent's screenshot and account"
 },
 {
  "id": "1360-06-26-state",
  "date": "1360-06-26",
  "type": "strait_change",
  "title": "Granadan sovereignty reaches 100, the full measure; influence −3.1, tipping just toward Qashtāla",
  "data": {
   "sovereignty": 100,
   "influence": -3.07
  },
  "source": "save of 26 June 1360"
 },
 {
  "id": "1360-06-26-chance-lost",
  "date": "1360-06-26",
  "type": "player_note",
  "people": [
   "yusuf-i"
  ],
  "wars": [
   "marinid-submission-war"
  ],
  "title": "The court's bitterness: Qashtāla and Portugal had bled in Arghūn (their losses reckoned at 10,000 and 30,000) and lay open to a war of independence. Instead Gharnāṭa must spend its own men throwing back the Marīnids until Qashtāla can send its levies south",
  "data": {
   "castilePortugalLossesInAragon": "10k/30k (Trent's figures)"
  },
  "source": "Trent's account"
 },
 {
  "id": "1360-08-13-battle-strait",
  "date": "1360-08-13",
  "type": "battle",
  "people": [],
  "places": [],
  "wars": [
   "marinid-submission-war"
  ],
  "title": "A Castilian squadron beats off a Marīnid one in the Strait",
  "data": {
   "result": "allied victory",
   "naval": true,
   "ours": {
    "Castile": 7000
   },
   "oursLost": 1000,
   "theirs": {
    "Morocco": 4000
   },
   "theirsLost": 1000,
   "location": "the Strait"
  },
  "source": "save of 10 June 1362"
 },
 {
  "id": "1360-09-01-battle-strait",
  "date": "1360-09-01",
  "type": "battle",
  "people": [],
  "places": [],
  "wars": [
   "marinid-submission-war"
  ],
  "title": "The Marīnid fleet, 17,000 strong, worsts the Castilians in the Strait",
  "data": {
   "result": "defeat",
   "naval": true,
   "ours": {
    "Castile": 6000
   },
   "oursLost": 1000,
   "theirs": {
    "Morocco": 17000
   },
   "theirsLost": 0,
   "location": "the Strait"
  },
  "source": "save of 10 June 1362"
 },
 {
  "id": "1360-09-13-battle-costa-sol",
  "date": "1360-09-13",
  "type": "battle",
  "people": [],
  "places": [],
  "wars": [
   "marinid-submission-war"
  ],
  "title": "Off the coast of Mālaqa the great Marīnid fleet of 61,000 destroys a Portuguese squadron",
  "data": {
   "result": "defeat",
   "naval": true,
   "ours": {
    "Portugal": 2000
   },
   "oursLost": 2000,
   "theirs": {
    "Morocco": 61000
   },
   "theirsLost": 1000,
   "location": "the Costa del Sol"
  },
  "source": "save of 10 June 1362"
 },
 {
  "id": "1360-10-28-battle-bay-cadiz",
  "date": "1360-10-28",
  "type": "battle",
  "people": [],
  "places": [],
  "wars": [
   "marinid-submission-war"
  ],
  "title": "Tilimsān's fleet sinks a Castilian squadron in the bay of Qādis",
  "data": {
   "result": "defeat",
   "naval": true,
   "ours": {
    "Castile": 6000
   },
   "oursLost": 6000,
   "theirs": {
    "Tlemcen": 48000
   },
   "theirsLost": 1000,
   "location": "the bay of Qādis"
  },
  "source": "save of 10 June 1362"
 },
 {
  "id": "1360-11-07-battle-almeria",
  "date": "1360-11-07",
  "type": "battle",
  "people": [
   "yusuf-i"
  ],
  "places": [
   "al-mariyya"
  ],
  "wars": [
   "marinid-submission-war"
  ],
  "title": "Victory at al-Mariyya: a Tilimsānī landing of 2,000 is thrown back into the sea by 10,500 Granadans, losing 1,700 men to our 1,000",
  "data": {
   "result": "victory",
   "naval": false,
   "ours": {
    "Granada": 10571
   },
   "oursLost": 1023,
   "theirs": {
    "Tlemcen": 2052
   },
   "theirsLost": 1665,
   "location": "al-Mariyya"
  },
  "source": "save of 10 June 1362"
 },
 {
  "id": "1360-11-14-diwan-al-mustakhlas",
  "date": "1360-11-14",
  "type": "reform",
  "people": [
   "yusuf-i"
  ],
  "places": [
   "gharnata"
  ],
  "title": "The Dīwān al-Mustakhlaṣ is founded to administer the sultan's private domain, the estates, mills and revenues set apart from the public treasury to fund the court and al-Ḥamrāʾ. A new bureaucracy grows from the harem's widening influence, in the middle of the Marīnid war",
  "data": {
   "bureaucracy": "Dīwān al-Mustakhlaṣ",
   "cost": "43.58 political influence",
   "positive": {
    "crownPower": "+10%"
   },
   "constant": {
    "taxEfficiency": "+5%"
   },
   "negative": {
    "estateEnrichment": "+15%"
   },
   "likes": {
    "burghers": "+1% satisfaction equilibrium"
   },
   "dislikes": {
    "nobles": "-1% satisfaction equilibrium"
   },
   "maxCost": 5.45
  },
  "source": "Trent's screenshot of the bureaucracy choice and his account"
 }
]