[
 {
  "id": "1370-06-morocco-near-defeat",
  "date": "1370-06-01",
  "type": "player_note",
  "people": [
   "saad-ibn-yusuf"
  ],
  "wars": [
   "second-marinid-submission-war"
  ],
  "title": "After several more battles, Morocco is nearly beaten by June 1370. The victory has cost a great many lives",
  "data": {},
  "source": "Trent's account (by June 1370; no save yet; the battles will be filled in from the save at the peace)"
 }
]
